<?xml version="1.0" encoding="UTF-8"?>
<!--Sample XML file generated by XMLSpy v2010 (http://www.altova.com)-->
<tns:request xsi:schemaLocation="http://www.example.org/cfp/ cfp.xsd" xmlns:tns="http://www.example.org/cfp/" xmlns:xsi="http://www.w3.org/2001/XMLSchema-instance">
	<request>
		<keyword>String</keyword>
		<keyword>String</keyword>
		<keyword>String</keyword>
		<author>String</author>
		<author>String</author>
		<author>String</author>
		<subjectArea>String</subjectArea>
		<fromYear>0</fromYear>
		<toYear>0</toYear>
		<journal>String</journal>
	</request>
</tns:request>
